{"additional_references":[],"citation_bindings":[{"clause_ids":["P-67.3.2:clause:0002"],"occurrence_ids":["P-67.3.2:xref:0001"],"ordered_member_refs":[],"reference_id":"citation.p67.2","relation":"cites","resolution":"exact"}],"clause_dispositions":[{"clause_id":"P-67.3.2:clause:0001","disposition":{"kind":"nonoperative","reason_code":"heading_or_title"},"force":"informative","role":"heading"},{"clause_id":"P-67.3.2:clause:0002","disposition":{"kind":"compiled","targets":[{"id":"unit.p67.part004.disulfurous_acid_homogeneous_diacid_structure","kind":"semantic_unit"},{"id":"expr.p67.part004.disulfurous_acid_homogeneous_diacid_structure.scope","kind":"expression"},{"id":"expr.p67.part004.disulfurous_acid_homogeneous_diacid_structure.value","kind":"expression"}]},"force":"normative","role":"definition"},{"clause_id":"P-67.3.2:clause:0003","disposition":{"kind":"compiled","targets":[{"id":"unit.p67.part004.disulfurous_acid_name_collision","kind":"semantic_unit"},{"id":"expr.p67.part004.disulfurous_acid_name_collision.scope","kind":"expression"},{"id":"expr.p67.part004.disulfurous_acid_name_collision.value","kind":"expression"}]},"force":"normative","role":"constraint"},{"clause_id":"P-67.3.2:clause:0004","disposition":{"kind":"compiled","targets":[{"id":"unit.p67.part004.substitutive_name_method","kind":"semantic_unit"},{"id":"expr.p67.part004.substitutive_name_method.scope","kind":"expression"},{"id":"expr.p67.part004.substitutive_name_method.value","kind":"expression"}]},"force":"normative","role":"preference_criterion"},{"clause_id":"P-67.3.2:clause:0005","disposition":{"kind":"compiled","targets":[{"id":"unit.p67.part004.disulfurous_acid_systematic_name_reservation","kind":"semantic_unit"},{"id":"expr.p67.part004.disulfurous_acid_systematic_name_reservation.scope","kind":"expression"},{"id":"expr.p67.part004.disulfurous_acid_systematic_name_reservation.value","kind":"expression"}]},"force":"normative","role":"constraint"},{"clause_id":"P-67.3.2:clause:0006","disposition":{"kind":"compiled","targets":[{"id":"unit.p67.part004.preselected_name_assignment","kind":"semantic_unit"},{"id":"expr.p67.part004.preselected_name_assignment.scope","kind":"expression"},{"id":"expr.p67.part004.preselected_name_assignment.value","kind":"expression"}]},"force":"normative","role":"definition"},{"clause_id":"P-67.3.2:clause:0007","disposition":{"kind":"nonoperative","reason_code":"example_label"},"force":"illustrative","role":"example"},{"clause_id":"P-67.3.2:clause:0008","disposition":{"kind":"compiled","targets":[{"id":"example.p67.part004.homogeneous_diacid_preselected_name","kind":"example"}]},"force":"illustrative","role":"example"},{"clause_id":"P-67.3.2:clause:0009","disposition":{"kind":"compiled","targets":[{"id":"example.p67.part004.dimethoxy_dithioxane_dione_pin","kind":"example"}]},"force":"illustrative","role":"example"},{"clause_id":"P-67.3.2:clause:0010","disposition":{"kind":"compiled","targets":[{"id":"example.p67.part004.dimethoxy_dithioxane_diimine_pin","kind":"example"}]},"force":"illustrative","role":"example"}],"correction_applications":[],"delta_sha256":"21847135E2F58996FFD5C5BC2866D316B8E150CE32450F1E21BE6D44D9B6213B","examples":[{"accepted_names":["1,3-dihydroxy-1λ4,3λ4-dithioxane-1,3-dione"],"clause_ids":["P-67.3.2:clause:0008"],"demonstrates":[{"id":"unit.p67.part004.preselected_name_assignment","kind":"semantic_unit"}],"example_id":"example.p67.part004.homogeneous_diacid_preselected_name","explanation":"The structure is assigned the preselected substitutive name shown in the example.","input":{"name_role":"preselected name","structure":"HO-SO-O-SO-OH"},"operative":false,"rejected_names":[]},{"accepted_names":["1,3-dimethoxy-1λ4,3λ4-dithioxane-1,3-dione"],"clause_ids":["P-67.3.2:clause:0009"],"demonstrates":[{"id":"unit.p67.part004.substitutive_name_method","kind":"semantic_unit"}],"example_id":"example.p67.part004.dimethoxy_dithioxane_dione_pin","explanation":"The methyl-substituted structure is named by the substitutive method and the result is a PIN.","input":{"name_role":"preferred IUPAC name","structure":"CH3-O-S(=O)-O-S(=O)-O-CH3"},"operative":false,"rejected_names":[]},{"accepted_names":["1,3-dimethoxy-1λ4,3λ4-dithioxane-1,3-diimine"],"clause_ids":["P-67.3.2:clause:0010"],"demonstrates":[{"id":"unit.p67.part004.substitutive_name_method","kind":"semantic_unit"}],"example_id":"example.p67.part004.dimethoxy_dithioxane_diimine_pin","explanation":"The imine analogue is named by the same substitutive framework with the terminal functional class reflected in diimine.","input":{"name_role":"preferred IUPAC name","structure":"CH3-O-S(=NH)-O-S(=NH)-O-CH3"},"operative":false,"rejected_names":[]}],"exceptions":[],"figures":[],"format":"iupac-bluebook-semantic-decision-delta","format_version":"1.0.0","semantic_units":[{"clause_ids":["P-67.3.2:clause:0002"],"entity_type":"HomogeneousDiacidName","force":"definition","inputs":[],"kind":"definition","outputs":[],"scope":{"applies_to":{"clause_ids":["P-67.3.2:clause:0002"],"expression_id":"expr.p67.part004.disulfurous_acid_homogeneous_diacid_structure.scope","op":"literal","value":true},"regimes":["all"]},"term":"disulfurous acid","unit_id":"unit.p67.part004.disulfurous_acid_homogeneous_diacid_structure","value":{"clause_ids":["P-67.3.2:clause:0002"],"expression_id":"expr.p67.part004.disulfurous_acid_homogeneous_diacid_structure.value","op":"literal","value":{"basis":"P-67.2","class":"homogeneous diacid","name":"disulfurous acid","structure":"HO-SO-O-SO-OH"}}},{"clause_ids":["P-67.3.2:clause:0003"],"entity_type":"NameCollisionResolution","force":"definition","inputs":[],"kind":"definition","outputs":[],"scope":{"applies_to":{"clause_ids":["P-67.3.2:clause:0003"],"expression_id":"expr.p67.part004.disulfurous_acid_name_collision.scope","op":"literal","value":true},"regimes":["all"]},"term":"disulfurous acid name collision","unit_id":"unit.p67.part004.disulfurous_acid_name_collision","value":{"clause_ids":["P-67.3.2:clause:0003"],"expression_id":"expr.p67.part004.disulfurous_acid_name_collision.value","op":"literal","value":{"consequence":"assign a different name to the target structure","reported_name":"disulfurous acid","reported_structure":"HO-SO-SO2-OH","source":"Nomenclature of Inorganic Chemistry, ref. 12","target_structure":"HO-SO-O-SO-OH"}}},{"clause_ids":["P-67.3.2:clause:0004"],"entity_type":"NamingMethodSelection","force":"definition","inputs":[],"kind":"definition","outputs":[],"scope":{"applies_to":{"clause_ids":["P-67.3.2:clause:0004"],"expression_id":"expr.p67.part004.substitutive_name_method.scope","op":"literal","value":true},"regimes":["all"]},"term":"substitutive naming method","unit_id":"unit.p67.part004.substitutive_name_method","value":{"clause_ids":["P-67.3.2:clause:0004"],"expression_id":"expr.p67.part004.substitutive_name_method.value","op":"literal","value":{"applies_to":"HO-SO-O-SO-OH","method":"substitutive","reason":"the name disulfurous acid is already used for another structure"}}},{"clause_ids":["P-67.3.2:clause:0005"],"entity_type":"SystematicNameAvailability","force":"definition","inputs":[],"kind":"definition","outputs":[],"scope":{"applies_to":{"clause_ids":["P-67.3.2:clause:0005"],"expression_id":"expr.p67.part004.disulfurous_acid_systematic_name_reservation.scope","op":"literal","value":true},"regimes":["all"]},"term":"systematic-name availability for disulfurous acid","unit_id":"unit.p67.part004.disulfurous_acid_systematic_name_reservation","value":{"clause_ids":["P-67.3.2:clause:0005"],"expression_id":"expr.p67.part004.disulfurous_acid_systematic_name_reservation.value","op":"literal","value":{"name":"disulfurous acid","reason":"used for HO-SO-SO2-OH in the Nomenclature of Inorganic Chemistry, ref. 12","structure":"HO-SO-O-SO-OH","systematic_name_use":"not available"}}},{"clause_ids":["P-67.3.2:clause:0006"],"entity_type":"PreselectedNameAssignment","force":"definition","inputs":[],"kind":"definition","outputs":[],"scope":{"applies_to":{"clause_ids":["P-67.3.2:clause:0006"],"expression_id":"expr.p67.part004.preselected_name_assignment.scope","op":"literal","value":true},"regimes":["all"]},"term":"preselected name for HO-SO-O-SO-OH","unit_id":"unit.p67.part004.preselected_name_assignment","value":{"clause_ids":["P-67.3.2:clause:0006"],"expression_id":"expr.p67.part004.preselected_name_assignment.value","op":"literal","value":{"name":"1,3-dihydroxy-1λ4,3λ4-dithioxane-1,3-dione","status":"preselected name","structure":"HO-SO-O-SO-OH"}}}],"symbol_declarations":[],"tables":[],"task_id":"P-67-part-004","task_sha256":"2203FD8E9C8F666D7B2EFE6FFF5B974B167DC6DD0576EC516666B77CC6FB76E7"}
