{"additional_references":[],"citation_bindings":[],"clause_dispositions":[{"clause_id":"P-80:clause:0001","disposition":{"kind":"nonoperative","reason_code":"heading_or_title"},"force":"informative","role":"heading"},{"clause_id":"P-80:clause:0002","disposition":{"kind":"compiled","targets":[{"id":"unit.p80.part001.isotopic_nomenclature_scope","kind":"semantic_unit"},{"id":"expr.p80.part001.isotopic_nomenclature_scope.scope","kind":"expression"},{"id":"expr.p80.part001.isotopic_nomenclature_scope.value","kind":"expression"},{"id":"expr.p80.part001.isotopic_nomenclature_scope.value.arg1","kind":"expression"},{"id":"expr.p80.part001.isotopic_nomenclature_scope.value.arg1.arg1","kind":"expression"},{"id":"expr.p80.part001.isotopic_nomenclature_scope.value.arg2","kind":"expression"},{"id":"expr.p80.part001.isotopic_nomenclature_scope.value.arg2.arg1","kind":"expression"}]},"force":"normative","role":"scope"},{"clause_id":"P-80:clause:0003","disposition":{"kind":"nonoperative","reason_code":"source_navigation"},"force":"informative","role":"cross_reference"},{"clause_id":"P-80:clause:0004","disposition":{"kind":"nonoperative","reason_code":"historical_context"},"force":"informative","role":"history"},{"clause_id":"P-80:clause:0005","disposition":{"kind":"nonoperative","reason_code":"historical_context"},"force":"informative","role":"history"},{"clause_id":"P-80:clause:0006","disposition":{"kind":"nonoperative","reason_code":"citation_only"},"force":"informative","role":"cross_reference"},{"clause_id":"P-80:clause:0007","disposition":{"kind":"nonoperative","reason_code":"historical_context"},"force":"informative","role":"history"},{"clause_id":"P-80:clause:0008","disposition":{"kind":"nonoperative","reason_code":"historical_context"},"force":"informative","role":"history"},{"clause_id":"P-80:clause:0009","disposition":{"kind":"nonoperative","reason_code":"rationale"},"force":"informative","role":"rationale"}],"correction_applications":[],"delta_sha256":"34CCA63DF05B7CB9A4FA77EF066A14124681BC296680E335487B67DF82288D33","examples":[],"exceptions":[],"figures":[],"format":"iupac-bluebook-semantic-decision-delta","format_version":"1.0.0","semantic_units":[{"clause_ids":["P-80:clause:0002"],"entity_type":"organic_compound","force":"definition","inputs":[{"name":"compound","type":"organic_compound"}],"kind":"definition","outputs":[{"name":"result","type":"boolean"}],"scope":{"applies_to":{"clause_ids":["P-80:clause:0002"],"expression_id":"expr.p80.part001.isotopic_nomenclature_scope.scope","op":"literal","value":true},"regimes":["all"]},"term":"organic compound within the scope of isotopic nomenclature","unit_id":"unit.p80.part001.isotopic_nomenclature_scope","value":{"args":[{"args":[{"clause_ids":["P-80:clause:0002"],"expression_id":"expr.p80.part001.isotopic_nomenclature_scope.value.arg1.arg1","name":"compound","op":"var"}],"clause_ids":["P-80:clause:0002"],"expression_id":"expr.p80.part001.isotopic_nomenclature_scope.value.arg1","op":"predicate","symbol":"compound.is_organic"},{"args":[{"clause_ids":["P-80:clause:0002"],"expression_id":"expr.p80.part001.isotopic_nomenclature_scope.value.arg2.arg1","name":"compound","op":"var"}],"clause_ids":["P-80:clause:0002"],"expression_id":"expr.p80.part001.isotopic_nomenclature_scope.value.arg2","op":"predicate","symbol":"compound.isotopic_nuclide_composition_deviates_from_natural"}],"clause_ids":["P-80:clause:0002"],"expression_id":"expr.p80.part001.isotopic_nomenclature_scope.value","op":"all"}}],"symbol_declarations":[{"arguments":[{"name":"compound","type":"compound"}],"description":"A compound is an organic compound.","grounding":{"kind":"primitive","primitive":"organic_compound","refs":[]},"kind":"predicate","returns":"boolean","symbol_id":"compound.is_organic"},{"arguments":[{"name":"compound","type":"organic_compound"}],"description":"A compound's isotopic nuclide composition deviates from natural composition.","grounding":{"kind":"primitive","primitive":"isotopic_composition_deviation_from_natural","refs":[]},"kind":"predicate","returns":"boolean","symbol_id":"compound.isotopic_nuclide_composition_deviates_from_natural"}],"tables":[],"task_id":"P-80-part-001","task_sha256":"407031630C4C4C4C8EFB9BB595A48A273DEAD938C947F2116098602B094E9226"}
