{"additional_references":[],"citation_bindings":[],"clause_dispositions":[{"clause_id":"P-76:clause:0001","disposition":{"kind":"nonoperative","reason_code":"heading_or_title"},"force":"informative","role":"heading"},{"clause_id":"P-76:clause:0002","disposition":{"kind":"compiled","targets":[{"id":"unit.p76.part001.delocalized_center_naming","kind":"semantic_unit"},{"id":"expr.p76.part001.delocalized_center_naming.scope","kind":"expression"},{"id":"expr.p76.part001.delocalized_center_naming.when","kind":"expression"},{"id":"expr.p76.part001.delocalized_center_naming.when.arg1","kind":"expression"},{"id":"stmt.p76.part001.delocalized_center_naming.then.1","kind":"statement"},{"id":"expr.p76.part001.delocalized_center_naming.then.1.arg1","kind":"expression"}]},"force":"normative","role":"effect"},{"clause_id":"P-76:clause:0003","disposition":{"kind":"nonoperative","reason_code":"example_label"},"force":"illustrative","role":"example"},{"clause_id":"P-76:clause:0004","disposition":{"kind":"compiled","targets":[{"id":"example.p76.part001.cyclopentadienyl_center_names","kind":"example"}]},"force":"illustrative","role":"example"},{"clause_id":"P-76:clause:0005","disposition":{"kind":"compiled","targets":[{"id":"figure.p76.part001.cyclopentadienyl_center_structure","kind":"figure"},{"id":"example.p76.part001.cyclopentadienyl_center_names","kind":"example"}]},"force":"illustrative","role":"figure_asset"},{"clause_id":"P-76:clause:0006","disposition":{"kind":"compiled","targets":[{"id":"example.p76.part001.benzo_annulenylium_name","kind":"example"}]},"force":"illustrative","role":"example"},{"clause_id":"P-76:clause:0007","disposition":{"kind":"compiled","targets":[{"id":"figure.p76.part001.benzo_annulenylium_structure","kind":"figure"},{"id":"example.p76.part001.benzo_annulenylium_name","kind":"example"}]},"force":"illustrative","role":"figure_asset"},{"clause_id":"P-76:clause:0008","disposition":{"kind":"compiled","targets":[{"id":"example.p76.part001.pentadienyl_name","kind":"example"}]},"force":"illustrative","role":"example"},{"clause_id":"P-76:clause:0009","disposition":{"kind":"compiled","targets":[{"id":"figure.p76.part001.pentadienyl_structure","kind":"figure"},{"id":"example.p76.part001.pentadienyl_name","kind":"example"}]},"force":"illustrative","role":"figure_asset"}],"correction_applications":[],"delta_sha256":"46DF53CE7B1D0790D0CBFBD57A36F9E207B13254478FEE83A3DE9D257F556F69","examples":[{"accepted_names":["cyclopentadienyl (PIN)","cyclopentadienylium (PIN)","cyclopentadienide (PIN)"],"clause_ids":["P-76:clause:0004","P-76:clause:0005"],"demonstrates":[{"id":"figure.p76.part001.cyclopentadienyl_center_structure","kind":"figure"}],"example_id":"example.p76.part001.cyclopentadienyl_center_names","explanation":"The appropriate suffix identifies the radical or ionic center without locants.","input":{"delocalized_center":"one radical or ionic center","x_options":[{"name":"cyclopentadienyl (PIN)","x":"•"},{"name":"cyclopentadienylium (PIN)","x":"+"},{"name":"cyclopentadienide (PIN)","x":"–"}]},"operative":false,"rejected_names":[]},{"accepted_names":["benzo[7]annulenylium (PIN)"],"clause_ids":["P-76:clause:0006","P-76:clause:0007"],"demonstrates":[{"id":"figure.p76.part001.benzo_annulenylium_structure","kind":"figure"}],"example_id":"example.p76.part001.benzo_annulenylium_name","explanation":"The delocalized ionic center is denoted by the suffix in the preferred IUPAC name.","input":{"delocalized_center":"ionic","structure":"benzo[7]annulene"},"operative":false,"rejected_names":[]},{"accepted_names":["pentadienyl (PIN)"],"clause_ids":["P-76:clause:0008","P-76:clause:0009"],"demonstrates":[{"id":"figure.p76.part001.pentadienyl_structure","kind":"figure"}],"example_id":"example.p76.part001.pentadienyl_name","explanation":"The radical suffix is used without locants for the delocalized center.","input":{"delocalized_center":"radical","structure":"pentadiene"},"operative":false,"rejected_names":[]}],"exceptions":[],"figures":[{"clause_ids":["P-76:clause:0005"],"content_sha256":null,"figure_id":"figure.p76.part001.cyclopentadienyl_center_structure","kind":"chemical_structure","source_urls":["https://iupac.qmul.ac.uk/BlueBook/P7gif/P76100a.gif"]},{"clause_ids":["P-76:clause:0007"],"content_sha256":null,"figure_id":"figure.p76.part001.benzo_annulenylium_structure","kind":"chemical_structure","source_urls":["https://iupac.qmul.ac.uk/BlueBook/P7gif/P76100b.gif"]},{"clause_ids":["P-76:clause:0009"],"content_sha256":null,"figure_id":"figure.p76.part001.pentadienyl_structure","kind":"chemical_structure","source_urls":["https://iupac.qmul.ac.uk/BlueBook/P7gif/P76100c.gif"]}],"format":"iupac-bluebook-semantic-decision-delta","format_version":"1.0.0","semantic_units":[{"clause_ids":["P-76:clause:0002"],"else":[],"force":"required","inputs":[{"name":"structure","type":"conjugated_structure"}],"kind":"rule","outputs":[{"name":"name","type":"name"}],"scope":{"applies_to":{"clause_ids":["P-76:clause:0002"],"expression_id":"expr.p76.part001.delocalized_center_naming.scope","op":"literal","value":true},"regimes":["all"]},"then":[{"args":[{"clause_ids":["P-76:clause:0002"],"expression_id":"expr.p76.part001.delocalized_center_naming.then.1.arg1","name":"structure","op":"var"}],"clause_ids":["P-76:clause:0002"],"op":"transform","statement_id":"stmt.p76.part001.delocalized_center_naming.then.1","target":"name","transformation":"name.add_appropriate_suffix_without_locants"}],"unit_id":"unit.p76.part001.delocalized_center_naming","when":{"args":[{"clause_ids":["P-76:clause:0002"],"expression_id":"expr.p76.part001.delocalized_center_naming.when.arg1","name":"structure","op":"var"}],"clause_ids":["P-76:clause:0002"],"expression_id":"expr.p76.part001.delocalized_center_naming.when","op":"predicate","symbol":"structure.has_one_delocalized_radical_or_ionic_center"}}],"symbol_declarations":[{"arguments":[{"name":"structure","type":"conjugated_structure"}],"description":"A structure has one radical or ionic center in an otherwise conjugated double-bond structure.","grounding":{"kind":"primitive","primitive":"structure_predicate","refs":[]},"kind":"predicate","returns":"boolean","symbol_id":"structure.has_one_delocalized_radical_or_ionic_center"},{"arguments":[{"name":"structure","type":"conjugated_structure"}],"description":"Denote one delocalized radical or ionic center by the appropriate suffix and omit locants.","grounding":{"kind":"primitive","primitive":"name_transformation","refs":[]},"kind":"transformation","returns":"name","symbol_id":"name.add_appropriate_suffix_without_locants"}],"tables":[],"task_id":"P-76-part-001","task_sha256":"D1227787A6D08029AE0B675566539D66B1350D15F8185A37A8FA3F0E7BF1EF80"}
